word_ko,word_en,sentence_ko,sentence_en
배우다,learn,우리는 새로운 기술을 배웠어요.,We learned a new skill.
역할,role,그녀는 중요한 역할을 맡았어요.,She took on an important role.
옆,side,그는 내 옆에 앉았어요.,He sat next to me.
행동,act,그의 행동은 예상치 못했어요.,His act was unexpected.
어,um,"어, 그게 뭐죠?","Um, what is that?"
국내,domestic,국내 여행은 편안해요.,Domestic travel is comfortable.
비하다,disparage,그는 다른 사람을 비하하지 않아요.,He does not disparage others.
기관,institution,이 기관은 오래된 역사를 가지고 있어요.,This institution has a long history.
입장,position,그의 입장은 명확하게 전달되었어요.,His position was clearly conveyed.
만하다,worthy,"이 영화는 볼 만해요.","This movie is worth watching."
아래,below,문서는 서랍 아래에 있어요.,The document is below the drawer.
방식,method,새로운 방식으로 문제를 해결했어요.,He solved the problem with a new method.
영향,influence,이 사건은 큰 영향을 끼쳤어요.,This event had a big influence.
나서다,step forward,그녀는 자원해서 나섰어요.,She volunteered to step forward.
흐르다,flow,강물은 조용히 흘러요.,The river flows quietly.
깊다,deep,"이 강은 깊어요, 조심해야 해요.","This river is deep, be careful."
내,my,내 생각은 다를 수 있어요.,My thoughts may be different.
산,mountain,우리는 산을 등반할 거예요.,We will climb the mountain.
하지만,however,"나는 가고 싶지만, 시간이 없어요.","I want to go, however, I don't have the time."
조건,condition,그 조건은 수용하기 어려워요.,That condition is hard to accept.
문,door,문을 조용히 닫아 주세요.,Please close the door quietly.
꽃,flower,꽃은 봄에 피어요.,Flowers bloom in the spring.
단계,stage,프로젝트는 다음 단계로 넘어갔어요.,The project moved to the next stage.
올리다,raise,그는 손을 올렸어요.,He raised his hand.
그동안,meanwhile,"그동안, 그는 많이 변했어요.","Meanwhile, he has changed a lot."
교사,teacher,교사는 학생들을 가르쳐요.,The teacher instructs the students.
갑자기,suddenly,그는 갑자기 일어났어요.,He suddenly stood up.
넘다,exceed,온도가 30도를 넘었어요.,The temperature exceeded 30 degrees.
지니다,possess,그녀는 특별한 기술을 지녔어요.,She possesses special skills.
잘하다,do well,그는 수학을 정말 잘해요.,He does really well in math.
마을,village,이 마을은 조용하고 평화로워요.,This village is quiet and peaceful.
대표,representative,그는 회사를 대표해요.,He represents the company.
가능성,possibility,가능성을 고려해 봐야 해요.,We must consider the possibility.
방향,direction,그녀는 반대 방향으로 갔어요.,She went in the opposite direction.
대회,competition,그는 대회에서 우승했어요.,He won the competition.
목소리,voice,그의 목소리는 매우 크요.,His voice is very loud.
노래,song,노래는 매우 감동적이었어요.,The song was very moving.
바다,sea,바다는 넓고 깊어요.,The sea is wide and deep.
힘들다,difficult,이 일은 매우 힘들어요.,This job is very difficult.
공부,study,그녀는 열심히 공부하고 있어요.,She studies hard.
움직이다,move,그는 조심스럽게 움직였어요.,He moved carefully.
의원,member,의원은 중요한 결정을 내렸어요.,The member made an important decision.
노력,effort,그의 노력은 인정받아야 해요.,His effort should be recognized.
전혀,not at all,"전혀 문제가 되지 않아요.","It is not a problem at all."
언니,older sister,언니는 항상 나를 도와요.,My older sister always helps me.
단체,organization,단체는 지역 사회를 지원해요.,The organization supports the community.
분,minute,다섯 분만 기다려 주세요.,Please wait just five minutes.
알려지다,become known,이 사실은 널리 알려졌어요.,This fact has become widely known.
가능하다,be possible,이 방법으로는 가능할 것 같아요.,It seems possible with this method.
능력,ability,그녀는 탁월한 능력을 가졌어요.,She has excellent abilities.
주장하다,assert,"그는 자신의 주장을 강하게 했어요.","He strongly asserted his claim."
자식,child,자식을 위해 최선을 다해요.,Parents do their best for their children.
돌리다,turn,그녀는 머리를 돌려서 나를 봤어요.,She turned her head to look at me.
불,fire,불은 빠르게 번져요.,The fire spreads quickly.
주민,resident,주민들은 회의에 참석했어요.,Residents attended the meeting.
모으다,gather,그들은 시위를 위해 모였어요.,They gathered for the protest.
자료,data,이 자료를 확인하세요.,Please check this data.
존재,existence,그 존재는 미스테리예요.,That existence is a mystery.
학년,grade,그녀는 이제 3학년입니다.,She is now in the 3rd grade.
신문,newspaper,매일 아침 신문을 읽어요.,I read the newspaper every morning.
가지다,have,우리는 시간이 많이 있어요.,We have a lot of time.
이해하다,understand,"이 문제를 이해하다 어려워요.","It's hard to understand this issue."
제품,product,새로운 제품을 출시했어요.,A new product has been launched.
분야,field,그는 의학 분야에서 일해요.,He works in the medical field.
선생,teacher,우리 선생님은 친절해요.,Our teacher is kind.
돌아가다,return,그는 어제 집으로 돌아갔어요.,He returned home yesterday.
사업,business,그들은 사업을 확장하고 있어요.,They are expanding their business.
행위,act,그 행위는 용납할 수 없어요.,That act is unacceptable.
수준,level,그 책의 난이도는 수준이 높아요.,The book's difficulty level is high.
지난해,last year,지난해 여행을 많이 했어요.,I traveled a lot last year.
표현,expression,"그녀의 얼굴 표현은 슬퍼 보였어요.","Her facial expression looked sad."
기분,feeling,오늘 기분이 좋지 않아요.,I'm not feeling well today.
젊다,young,그는 여전히 젊어 보여요.,He still looks young.
동시,simultaneously,우리는 동시에 도착했어요.,We arrived simultaneously.
옷,clothes,새 옷을 구입했어요.,I bought new clothes.
순간,moment,그 순간을 잊을 수 없어요.,I can't forget that moment.
전쟁,war,전쟁은 많은 것을 파괴했어요.,The war destroyed a lot.
꿈,dream,그는 이상한 꿈을 꿨어요.,He had a strange dream.
할머니,grandmother,할머니는 항상 우리를 사랑해요.,Grandmother always loves us.
방송,broadcast,그 방송은 인기가 많아요.,That broadcast is very popular.
이야기하다,talk,우리는 자주 이야기해요.,We talk often.
나무,tree,그 나무는 매우 오래되었어요.,That tree is very old.
자다,sleep,저는 충분히 자지 못했어요.,I didn't sleep enough.
연극,play,우리는 연극을 보러 갔어요.,We went to see a play.
오늘,today,오늘은 정말 바쁘네요.,Today is really busy.
마찬가지,likewise,그녀도 마찬가지로 생각해요.,She thinks likewise.
노동,labor,노동은 보람이 있어요.,Labor is rewarding.
이때,at this time,이때 그는 도착했어요.,"At this time, he arrived."
가치,value,이 경험은 큰 가치가 있어요.,This experience has great value.
시간,time,"시간이 빠르게 지나가요.","Time passes quickly."
집단,group,그 집단은 잘 조직되어 있어요.,The group is well organized.
현대,modern,현대 기술은 놀랍습니다.,Modern technology is amazing.
살펴보다,examine,우리는 문제를 살펴봤어요.,We examined the issue.
장관,minister,장관은 오늘 연설을 했어요.,The minister gave a speech today.
차이,difference,"이 두 개체 사이에는 큰 차이가 있어요.","There is a big difference between these two objects."
풀다,solve,우리는 그 문제를 풀었어요.,We solved that problem.
시절,times,그 시절은 정말 행복했어요.,Those times were really happy.
물건,thing,그 물건을 어디에 두었나요?,Where did you put that thing?
개인,individual,각 개인은 독특해요.,Each individual is unique.
근데,but,"근데, 왜 그렇게 생각해요?","But, why do you think so?"
발,foot,그녀는 발을 다쳤어요.,She injured her foot.
작가,author,그 작가는 많은 책을 썼어요.,The author has written many books.
효과,effect,그 약은 효과가 있어요.,The medicine is effective.
불교,Buddhism,불교는 아시아에서 유래했어요.,Buddhism originated in Asia.
끌다,attract,그 공연은 관객을 많이 끌었어요.,The performance attracted many spectators.
대로,as,"계획대로 일이 진행되고 있어요.","Things are progressing as planned."
